match,start_time,market_name,home_team,home_win,away_team,away_win,margin,agency
Pittsburgh Pirates v New York Mets,2024-07-09 02:05:00,Head To Head,Pittsburgh Pirates,1.85,New York Mets,2,1.041,BetRight
Washington Nationals v St. Louis Cardinals,2024-07-09 05:35:00,Head To Head,Washington Nationals,1.91,St. Louis Cardinals,1.93,1.042,BetRight
Detroit Tigers v Cleveland Guardians,2024-07-09 08:10:00,Head To Head,Detroit Tigers,2.24,Cleveland Guardians,1.68,1.042,BetRight
Cincinnati Reds v Colorado Rockies,2024-07-09 08:40:00,Head To Head,Cincinnati Reds,1.55,Colorado Rockies,2.52,1.042,BetRight
Chicago White Sox v Minnesota Twins,2024-07-09 09:40:00,Head To Head,Chicago White Sox,2.52,Minnesota Twins,1.55,1.042,BetRight
Los Angeles Angels v Texas Rangers,2024-07-09 11:08:00,Head To Head,Los Angeles Angels,2.24,Texas Rangers,1.68,1.042,BetRight
Arizona Diamondbacks v Atlanta Braves,2024-07-09 11:10:00,Head To Head,Arizona Diamondbacks,2.58,Atlanta Braves,1.53,1.041,BetRight
