match,home_team,away_team,start_time,player_name,player_team,opposition_team,line,over_price,under_price,market_name,agency
San Diego Padres v Seattle Mariners,San Diego Padres,Seattle Mariners,2025-05-18 10:10:00,Emerson Hancock,Seattle Mariners,San Diego Padres,15.5,2.05,1.6800000000000002,Pitcher Outs,Neds
San Diego Padres v Seattle Mariners,San Diego Padres,Seattle Mariners,2025-05-18 10:10:00,Nick Pivetta,San Diego Padres,Seattle Mariners,17.5,1.96,1.75,Pitcher Outs,Neds
San Francisco Giants v Oakland Athletics,San Francisco Giants,Oakland Athletics,2025-05-18 10:35:00,Luis Severino,Athletics,San Francisco Giants,17.5,1.72,2,Pitcher Outs,Neds
Los Angeles Dodgers v Los Angeles Angels,Los Angeles Dodgers,Los Angeles Angels,2025-05-18 10:40:00,Clayton Kershaw,NA,NA,14.5,1.92,1.78,Pitcher Outs,Neds
San Francisco Giants v Oakland Athletics,San Francisco Giants,Oakland Athletics,2025-05-18 10:35:00,Landen Roupp,San Francisco Giants,Oakland Athletics,15.5,2.02,1.72,Pitcher Outs,Neds
