match,start_time,market_name,home_team,away_team,home_win,away_win,margin,agency
Texas Rangers v Oakland Athletics,2025-07-24 09:35:00,Head To Head,Texas Rangers,Oakland Athletics,1.7,2.15,1.05,Neds
Detroit Tigers v Toronto Blue Jays,2025-07-25 08:10:00,Head To Head,Detroit Tigers,Toronto Blue Jays,1.72,2.15,1.05,Neds
Cleveland Guardians v Baltimore Orioles,2025-07-24 08:10:00,Head To Head,Cleveland Guardians,Baltimore Orioles,1.75,2.1,1.05,Neds
St. Louis Cardinals v San Diego Padres,2025-07-25 09:15:00,Head To Head,St. Louis Cardinals,San Diego Padres,1.72,2.15,1.05,Neds
Cleveland Guardians v Baltimore Orioles,2025-07-25 02:40:00,Head To Head,Cleveland Guardians,Baltimore Orioles,1.8199999999999998,2,1.05,Neds
Los Angeles Angels v Seattle Mariners,2025-07-25 11:08:00,Head To Head,Los Angeles Angels,Seattle Mariners,1.8199999999999998,2,1.05,Neds
Tampa Bay Rays v Chicago White Sox,2025-07-24 09:05:00,Head To Head,Tampa Bay Rays,Chicago White Sox,1.44,2.85,1.05,Neds
Toronto Blue Jays v New York Yankees,2025-07-24 08:37:00,Head To Head,Toronto Blue Jays,New York Yankees,2.15,1.7,1.05,Neds
Philadelphia Phillies v Boston Red Sox,2025-07-24 08:35:00,Head To Head,Philadelphia Phillies,Boston Red Sox,1.62,2.35,1.04,Neds
