match,start_time,market_name,home_team,away_team,home_win,away_win,margin,agency
Miami Marlins v Colorado Rockies,2025-06-03 08:10:00,Head To Head,Miami Marlins,Colorado Rockies,1.5699999999999998,2.45,1.05,Neds
Los Angeles Dodgers v New York Yankees,2025-06-02 08:40:00,Head To Head,Los Angeles Dodgers,New York Yankees,1.53,2.55,1.05,Neds
Boston Red Sox v Los Angeles Angels,2025-06-03 08:40:00,Head To Head,Boston Red Sox,Los Angeles Angels,1.6400000000000001,2.3,1.04,Neds
Cincinnati Reds v Milwaukee Brewers,2025-06-03 08:40:00,Head To Head,Cincinnati Reds,Milwaukee Brewers,1.78,2.05,1.05,Neds
Chicago White Sox v Detroit Tigers,2025-06-03 09:10:00,Head To Head,Chicago White Sox,Detroit Tigers,2.65,1.5,1.04,Neds
