match,start_time,market_name,home_team,away_team,home_win,away_win,margin,agency
Houston Astros v Tampa Bay Rays,2025-05-31 09:40:00,Head To Head,Houston Astros,Tampa Bay Rays,1.6400000000000001,2.25,1.05,Neds
Kansas City Royals v Detroit Tigers,2025-05-31 09:40:00,Head To Head,Kansas City Royals,Detroit Tigers,2,1.8199999999999998,1.05,Neds
Los Angeles Dodgers v New York Yankees,2025-05-31 11:40:00,Head To Head,Los Angeles Dodgers,New York Yankees,2.1,1.75,1.05,Neds
San Diego Padres v Pittsburgh Pirates,2025-05-31 11:10:00,Head To Head,San Diego Padres,Pittsburgh Pirates,1.53,2.55,1.05,Neds
Arizona Diamondbacks v Washington Nationals,2025-05-31 11:10:00,Head To Head,Arizona Diamondbacks,Washington Nationals,1.44,2.85,1.05,Neds
Seattle Mariners v Minnesota Twins,2025-05-31 11:40:00,Head To Head,Seattle Mariners,Minnesota Twins,1.67,2.25,1.04,Neds
Texas Rangers v St. Louis Cardinals,2025-05-31 09:35:00,Head To Head,Texas Rangers,St. Louis Cardinals,2.1,1.75,1.05,Neds
