match,start_time,market_name,home_team,away_team,line,home_price,away_price,margin,agency
Miami Marlins v Philadelphia Phillies,2025-06-17 08:10:00,Line,Miami Marlins,NA,1.5,1.62,NA,NA,Neds
Washington Nationals v Colorado Rockies,2025-06-17 08:15:00,Line,Washington Nationals,NA,-1.5,1.96,NA,NA,Neds
Los Angeles Dodgers v San Francisco Giants,2025-06-16 08:40:00,Line,Los Angeles Dodgers,San Francisco Giants,1.5,1.32,1.72,1.34,Neds
Los Angeles Dodgers v San Francisco Giants,2025-06-16 08:40:00,Line,Los Angeles Dodgers,San Francisco Giants,-2.5,2.7,4.4,0.6,Neds
Los Angeles Dodgers v San Francisco Giants,2025-06-16 08:40:00,Line,Los Angeles Dodgers,San Francisco Giants,-1.5,2.1,3.35,0.77,Neds
New York Yankees v Los Angeles Angels,2025-06-17 08:35:00,Line,New York Yankees,NA,-1.5,1.98,NA,NA,Neds
Seattle Mariners v Boston Red Sox,2025-06-17 11:10:00,Line,Seattle Mariners,NA,-1.5,2.3,NA,NA,Neds
Los Angeles Dodgers v San Francisco Giants,2025-06-16 08:40:00,Line,Los Angeles Dodgers,San Francisco Giants,2.5,1.2,1.46,1.52,Neds
