match,start_time,market_name,home_team,away_team,home_win,away_win,margin,agency
Los Angeles Dodgers v Philadelphia Phillies,2025-09-16 11:40:00,Head To Head,Los Angeles Dodgers,Philadelphia Phillies,1.8199999999999998,2,1.05,Neds
Houston Astros v Texas Rangers,2025-09-16 09:40:00,Head To Head,Houston Astros,Texas Rangers,1.75,2.1,1.05,Neds
Minnesota Twins v New York Yankees,2025-09-16 09:10:00,Head To Head,Minnesota Twins,New York Yankees,2.7,1.48,1.05,Neds
Pittsburgh Pirates v Chicago Cubs,2025-09-16 08:10:00,Head To Head,Pittsburgh Pirates,Chicago Cubs,2.05,1.78,1.05,Neds
St. Louis Cardinals v Cincinnati Reds,2025-09-16 09:15:00,Head To Head,St. Louis Cardinals,Cincinnati Reds,1.87,1.94,1.05,Neds
Chicago White Sox v Baltimore Orioles,2025-09-16 09:10:00,Head To Head,Chicago White Sox,Baltimore Orioles,2.2,1.6800000000000002,1.05,Neds
Washington Nationals v Atlanta Braves,2025-09-16 08:15:00,Head To Head,Washington Nationals,Atlanta Braves,2.45,1.5699999999999998,1.05,Neds
Arizona Diamondbacks v San Francisco Giants,2025-09-16 11:10:00,Head To Head,Arizona Diamondbacks,San Francisco Giants,1.75,2.1,1.05,Neds
Tampa Bay Rays v Toronto Blue Jays,2025-09-16 09:05:00,Head To Head,Tampa Bay Rays,Toronto Blue Jays,2.05,1.78,1.05,Neds
