match,start_time,market_name,home_team,away_team,line,home_price,away_price,margin,agency
Arizona Diamondbacks v Seattle Mariners,2025-06-10 11:10:00,Line,Arizona Diamondbacks,NA,-1.5,2.15,NA,NA,Neds
New York Yankees v Boston Red Sox,2025-06-09 08:40:00,Line,New York Yankees,Boston Red Sox,-1.5,1.9,4,0.78,Neds
New York Yankees v Boston Red Sox,2025-06-09 08:40:00,Line,New York Yankees,Boston Red Sox,2.5,1.1400000000000001,1.55,1.52,Neds
Boston Red Sox v Tampa Bay Rays,2025-06-10 08:40:00,Line,Boston Red Sox,NA,1.5,1.53,NA,NA,Neds
New York Yankees v Boston Red Sox,2025-06-09 08:40:00,Line,New York Yankees,Boston Red Sox,1.5,1.24,1.9,1.33,Neds
Cleveland Guardians v Cincinnati Reds,2025-06-10 08:10:00,Line,Cleveland Guardians,NA,-1.5,2.2,NA,NA,Neds
St. Louis Cardinals v Toronto Blue Jays,2025-06-10 09:15:00,Line,St. Louis Cardinals,NA,1.5,1.5,NA,NA,Neds
New York Yankees v Boston Red Sox,2025-06-09 08:40:00,Line,New York Yankees,Boston Red Sox,-2.5,2.45,5.5,0.59,Neds
