match,start_time,market_name,home_team,away_team,home_win,away_win,margin,agency
San Diego Padres v Arizona Diamondbacks,2025-07-11 11:10:00,Head To Head,San Diego Padres,Arizona Diamondbacks,2.05,1.78,1.05,Neds
St. Louis Cardinals v Washington Nationals,2025-07-11 09:15:00,Head To Head,St. Louis Cardinals,Washington Nationals,1.6800000000000002,2.2,1.05,Neds
Los Angeles Angels v Texas Rangers,2025-07-11 11:08:00,Head To Head,Los Angeles Angels,Texas Rangers,1.87,1.94,1.05,Neds
Chicago White Sox v Cleveland Guardians,2025-07-11 09:10:00,Head To Head,Chicago White Sox,Cleveland Guardians,2,1.8199999999999998,1.05,Neds
New York Yankees v Seattle Mariners,2025-07-11 08:35:00,Head To Head,New York Yankees,Seattle Mariners,1.94,1.87,1.05,Neds
Oakland Athletics v Atlanta Braves,2025-07-11 10:35:00,Head To Head,Oakland Athletics,Atlanta Braves,2.55,1.53,1.05,Neds
Boston Red Sox v Tampa Bay Rays,2025-07-11 08:40:00,Head To Head,Boston Red Sox,Tampa Bay Rays,1.87,1.94,1.05,Neds
