match,player_name,market_name,line,over_price,agency,under_price
Colorado Rockies v Arizona Diamondbacks,Brandon Pfaadt,Pitching Outs,17.5,2.01,Pinnacle,1.751
Colorado Rockies v Arizona Diamondbacks,Tanner Gordon,Pitching Outs,14.5,1.537,Pinnacle,2.39
Los Angeles Dodgers v San Diego Padres,Clayton Kershaw,Pitching Outs,16.5,1.925,Pinnacle,1.813
New York Mets v Seattle Mariners,Luis Castillo,Pitching Outs,17.5,1.961,Pinnacle,1.787
New York Mets v Seattle Mariners,Sean Manaea,Pitching Outs,15.5,1.877,Pinnacle,1.862
St. Louis Cardinals v New York Yankees,Luis Gil,Pitching Outs,15.5,2.06,Pinnacle,1.709
Washington Nationals v Philadelphia Phillies,MacKenzie Gore,Pitching Outs,16.5,1.806,Pinnacle,1.943
Washington Nationals v Philadelphia Phillies,Zack Wheeler,Pitching Outs,18.5,2.71,Pinnacle,1.425
