match,player_name,market_name,line,over_price,agency,under_price
Minnesota Twins v New York Yankees,Luis Gil,Pitching Outs,15.5,2.07,Pinnacle,1.709
Minnesota Twins v New York Yankees,Taj Bradley,Pitching Outs,15.5,2.23,Pinnacle,1.609
Pittsburgh Pirates v Chicago Cubs,Matthew Boyd,Pitching Outs,15.5,1.74,Pinnacle,2.02
St. Louis Cardinals v Cincinnati Reds,Andre Pallante,Pitching Outs,15.5,1.806,Pinnacle,1.934
St. Louis Cardinals v Cincinnati Reds,Brady Singer,Pitching Outs,17.5,1.819,Pinnacle,1.925
