match,player_name,market_name,line,over_price,agency,under_price
Atlanta Braves v Milwaukee Brewers,Spencer Strider,Pitching Outs,18.5,2.36,Pinnacle,1.546
Colorado Rockies v Toronto Blue Jays,Kevin Gausman,Pitching Outs,17.5,1.689,Pinnacle,2.09
Colorado Rockies v Toronto Blue Jays,Kyle Freeland,Pitching Outs,15.5,2.05,Pinnacle,1.714
Miami Marlins v Houston Astros,Janson Junk,Pitching Outs,15.5,2.22,Pinnacle,1.613
Pittsburgh Pirates v San Francisco Giants,Robbie Ray,Pitching Outs,17.5,1.833,Pinnacle,1.917
