match,player_name,market_name,line,over_price,agency,under_price
Cincinnati Reds v Chicago Cubs,Matthew Boyd(must start),Pitching Outs,17.5,1.847,Pinnacle,1.892
Detroit Tigers v Cleveland Guardians,Jack Flaherty(must start),Pitching Outs,16.5,1.625,Pinnacle,2.19
Detroit Tigers v Cleveland Guardians,Tanner Bibee(must start),Pitching Outs,17.5,1.641,Pinnacle,2.17
Minnesota Twins v Kansas City Royals,Pablo López(must start),Pitching Outs,18.5,2.57,Pinnacle,1.469
St. Louis Cardinals v Arizona Diamondbacks,Zac Gallen(must start),Pitching Outs,17.5,1.787,Pinnacle,1.961
Washington Nationals v Atlanta Braves,AJ Smith-Shawver(must start),Pitching Outs,16.5,1.961,Pinnacle,1.787
Washington Nationals v Atlanta Braves,Trevor Williams(must start),Pitching Outs,15.5,2.37,Pinnacle,1.546
