match,player_name,market_name,line,over_price,agency,under_price
Chicago Cubs v Colorado Rockies,Matthew Boyd(must start),Pitching Outs,17.5,1.625,Pinnacle,2.19
Chicago Cubs v Colorado Rockies,Tanner Gordon(must start),Pitching Outs,15.5,2.13,Pinnacle,1.666
Kansas City Royals v Cincinnati Reds,Hunter Greene(must start),Pitching Outs,17.5,1.552,Pinnacle,2.35
Los Angeles Angels v New York Yankees,Clarke Schmidt(must start),Pitching Outs,16.5,1.775,Pinnacle,1.97
Los Angeles Angels v New York Yankees,Yusei Kikuchi(must start),Pitching Outs,17.5,2.03,Pinnacle,1.729
Seattle Mariners v Washington Nationals,Trevor Williams(must start),Pitching Outs,15.5,2.52,Pinnacle,1.487
Texas Rangers v Toronto Blue Jays,Tyler Mahle(must start),Pitching Outs,17.5,1.609,Pinnacle,2.22
