match,start_time,market_name,home_team,home_win,away_team,away_win,margin,agency
Minnesota Twins v Texas Rangers,2025-06-13 02:40:00,Head To Head,Minnesota Twins,1.63,Texas Rangers,2.35,1.039,Pointsbet
New York Mets v Washington Nationals,2025-06-13 02:40:00,Head To Head,New York Mets,1.44,Washington Nationals,2.85,1.045,Pointsbet
Colorado Rockies v San Francisco Giants,2025-06-13 04:40:00,Head To Head,Colorado Rockies,2.85,San Francisco Giants,1.44,1.045,Pointsbet
Baltimore Orioles v Detroit Tigers,2025-06-13 08:05:00,Head To Head,Baltimore Orioles,2.6,Detroit Tigers,1.53,1.038,Pointsbet
Milwaukee Brewers v St. Louis Cardinals,2025-06-13 09:10:00,Head To Head,Milwaukee Brewers,2.15,St. Louis Cardinals,1.74,1.04,Pointsbet
Kansas City Royals v New York Yankees,2025-06-13 09:10:00,Head To Head,Kansas City Royals,2.25,New York Yankees,1.69,1.036,Pointsbet
Chicago Cubs v Pittsburgh Pirates,2025-06-13 09:35:00,Head To Head,Chicago Cubs,1.48,Pittsburgh Pirates,2.75,1.039,Pointsbet
Houston Astros v Chicago White Sox,2025-06-13 09:40:00,Head To Head,Houston Astros,1.42,Chicago White Sox,2.9,1.049,Pointsbet
