match,start_time,market_name,home_team,home_win,away_team,away_win,margin,agency
Pittsburgh Pirates v Chicago Cubs,2025-09-16 08:10:00,Head To Head,Pittsburgh Pirates,2.05,Chicago Cubs,1.8,1.043,Pointsbet
Washington Nationals v Atlanta Braves,2025-09-16 08:15:00,Head To Head,Washington Nationals,2.4,Atlanta Braves,1.59,1.046,Pointsbet
Tampa Bay Rays v Toronto Blue Jays,2025-09-16 09:05:00,Head To Head,Tampa Bay Rays,1.95,Toronto Blue Jays,1.87,1.048,Pointsbet
Minnesota Twins v New York Yankees,2025-09-16 09:10:00,Head To Head,Minnesota Twins,2.65,New York Yankees,1.5,1.044,Pointsbet
Chicago White Sox v Baltimore Orioles,2025-09-16 09:10:00,Head To Head,Chicago White Sox,2.2,Baltimore Orioles,1.71,1.039,Pointsbet
St. Louis Cardinals v Cincinnati Reds,2025-09-16 09:15:00,Head To Head,St. Louis Cardinals,1.9,Cincinnati Reds,1.9,1.053,Pointsbet
Houston Astros v Texas Rangers,2025-09-16 09:40:00,Head To Head,Houston Astros,1.77,Texas Rangers,2.1,1.041,Pointsbet
Arizona Diamondbacks v San Francisco Giants,2025-09-16 11:10:00,Head To Head,Arizona Diamondbacks,1.77,San Francisco Giants,2.1,1.041,Pointsbet
Los Angeles Dodgers v Philadelphia Phillies,2025-09-16 11:40:00,Head To Head,Los Angeles Dodgers,1.83,Philadelphia Phillies,2,1.046,Pointsbet
