match,start_time,market_name,home_team,home_win,away_team,away_win,margin,agency
Pittsburgh Pirates v New York Mets,2024-07-09 02:05:00,Head To Head,Pittsburgh Pirates,1.83,New York Mets,2,1.046,Pointsbet
Washington Nationals v St. Louis Cardinals,2024-07-09 05:35:00,Head To Head,Washington Nationals,1.9,St. Louis Cardinals,1.9,1.053,Pointsbet
Detroit Tigers v Cleveland Guardians,2024-07-09 08:10:00,Head To Head,Detroit Tigers,2.25,Cleveland Guardians,1.69,1.036,Pointsbet
Cincinnati Reds v Colorado Rockies,2024-07-09 08:40:00,Head To Head,Cincinnati Reds,1.56,Colorado Rockies,2.5,1.041,Pointsbet
Chicago White Sox v Minnesota Twins,2024-07-09 09:40:00,Head To Head,Chicago White Sox,2.5,Minnesota Twins,1.56,1.041,Pointsbet
Los Angeles Angels v Texas Rangers,2024-07-09 11:08:00,Head To Head,Los Angeles Angels,2.25,Texas Rangers,1.69,1.036,Pointsbet
Arizona Diamondbacks v Atlanta Braves,2024-07-09 11:10:00,Head To Head,Arizona Diamondbacks,2.5,Atlanta Braves,1.56,1.041,Pointsbet
