match,start_time,market_name,home_team,home_win,away_team,away_win,margin,agency
Cleveland Guardians v Baltimore Orioles,2025-07-25 02:40:00,Head To Head,Cleveland Guardians,1.9,Baltimore Orioles,1.9,1.053,Pointsbet
Detroit Tigers v Toronto Blue Jays,2025-07-25 08:10:00,Head To Head,Detroit Tigers,1.77,Toronto Blue Jays,2.1,1.041,Pointsbet
St. Louis Cardinals v San Diego Padres,2025-07-25 09:15:00,Head To Head,St. Louis Cardinals,1.74,San Diego Padres,2.15,1.04,Pointsbet
Houston Astros v Oakland Athletics,2025-07-25 09:40:00,Head To Head,Houston Astros,1.77,Oakland Athletics,2.1,1.041,Pointsbet
Los Angeles Angels v Seattle Mariners,2025-07-25 11:08:00,Head To Head,Los Angeles Angels,1.77,Seattle Mariners,2.1,1.041,Pointsbet
