match,start_time,market_name,home_team,home_win,away_team,away_win,margin,agency
Miami Marlins v Colorado Rockies,2025-06-03T07:40:00Z,Head To Head,Miami Marlins,1.49,Colorado Rockies,2.7,1.042,Sportsbet
Cincinnati Reds v Milwaukee Brewers,2025-06-03T08:10:00Z,Head To Head,Cincinnati Reds,1.8,Milwaukee Brewers,2.06,1.041,Sportsbet
Boston Red Sox v Los Angeles Angels,2025-06-03T08:10:00Z,Head To Head,Boston Red Sox,1.67,Los Angeles Angels,2.26,1.041,Sportsbet
Chicago White Sox v Detroit Tigers,2025-06-03T08:40:00Z,Head To Head,Chicago White Sox,2.69,Detroit Tigers,1.5,1.038,Sportsbet
Oakland Athletics v Minnesota Twins,2025-06-03T11:05:00Z,Head To Head,Oakland Athletics,2.37,Minnesota Twins,1.62,1.039,Sportsbet
Los Angeles Dodgers v New York Mets,2025-06-03T11:10:00Z,Head To Head,Los Angeles Dodgers,1.62,New York Mets,2.35,1.043,Sportsbet
