match,start_time,market_name,home_team,home_win,away_team,away_win,margin,agency
Baltimore Orioles v Texas Rangers,2025-06-24T07:35:00Z,Head To Head,Baltimore Orioles,1.76,Texas Rangers,2.07,1.051,Sportsbet
Cincinnati Reds v New York Yankees,2025-06-24T08:10:00Z,Head To Head,Cincinnati Reds,2.04,New York Yankees,1.78,1.052,Sportsbet
New York Mets v Atlanta Braves,2025-06-24T08:10:00Z,Head To Head,New York Mets,2.17,Atlanta Braves,1.69,1.053,Sportsbet
Chicago White Sox v Arizona Diamondbacks,2025-06-24T08:40:00Z,Head To Head,Chicago White Sox,2.08,Arizona Diamondbacks,1.74,1.055,Sportsbet
Milwaukee Brewers v Pittsburgh Pirates,2025-06-24T08:40:00Z,Head To Head,Milwaukee Brewers,1.5,Pittsburgh Pirates,2.62,1.048,Sportsbet
Minnesota Twins v Seattle Mariners,2025-06-24T08:40:00Z,Head To Head,Minnesota Twins,2.02,Seattle Mariners,1.8,1.051,Sportsbet
St. Louis Cardinals v Chicago Cubs,2025-06-24T08:45:00Z,Head To Head,St. Louis Cardinals,1.89,Chicago Cubs,1.91,1.053,Sportsbet
Los Angeles Angels v Boston Red Sox,2025-06-24T10:38:00Z,Head To Head,Los Angeles Angels,1.98,Boston Red Sox,1.82,1.055,Sportsbet
San Diego Padres v Washington Nationals,2025-06-24T10:40:00Z,Head To Head,San Diego Padres,1.6,Washington Nationals,2.28,1.064,Sportsbet
