match,start_time,market_name,home_team,home_win,away_team,away_win,margin,agency
Pittsburgh Pirates v Miami Marlins,2025-06-10T07:40:00Z,Head To Head,Pittsburgh Pirates,1.83,Miami Marlins,1.98,1.051,Sportsbet
Cleveland Guardians v Cincinnati Reds,2025-06-10T07:40:00Z,Head To Head,Cleveland Guardians,1.65,Cincinnati Reds,2.25,1.051,Sportsbet
Philadelphia Phillies v Chicago Cubs,2025-06-10T07:45:00Z,Head To Head,Philadelphia Phillies,1.76,Chicago Cubs,2.07,1.051,Sportsbet
Boston Red Sox v Tampa Bay Rays,2025-06-10T08:10:00Z,Head To Head,Boston Red Sox,1.87,Tampa Bay Rays,1.93,1.053,Sportsbet
Milwaukee Brewers v Atlanta Braves,2025-06-10T08:40:00Z,Head To Head,Milwaukee Brewers,2.47,Atlanta Braves,1.55,1.05,Sportsbet
St. Louis Cardinals v Toronto Blue Jays,2025-06-10T08:45:00Z,Head To Head,St. Louis Cardinals,1.85,Toronto Blue Jays,1.96,1.051,Sportsbet
Los Angeles Angels v Oakland Athletics,2025-06-10T10:38:00Z,Head To Head,Los Angeles Angels,1.65,Oakland Athletics,2.29,1.043,Sportsbet
San Diego Padres v Los Angeles Dodgers,2025-06-10T10:40:00Z,Head To Head,San Diego Padres,2.03,Los Angeles Dodgers,1.82,1.042,Sportsbet
Arizona Diamondbacks v Seattle Mariners,2025-06-10T10:40:00Z,Head To Head,Arizona Diamondbacks,1.59,Seattle Mariners,2.44,1.039,Sportsbet
