match,start_time,market_name,home_team,home_win,away_team,away_win,margin,agency
New York Yankees v Texas Rangers,2025-05-23T01:35:00Z,Head To Head,New York Yankees,1.63,Texas Rangers,2.29,1.05,Sportsbet
Toronto Blue Jays v San Diego Padres,2025-05-23T02:07:00Z,Head To Head,Toronto Blue Jays,1.97,San Diego Padres,1.84,1.051,Sportsbet
Colorado Rockies v Philadelphia Phillies,2025-05-23T04:10:00Z,Head To Head,Colorado Rockies,3.48,Philadelphia Phillies,1.31,1.051,Sportsbet
Oakland Athletics v Los Angeles Angels,2025-05-23T04:35:00Z,Head To Head,Oakland Athletics,1.76,Los Angeles Angels,2.07,1.051,Sportsbet
Pittsburgh Pirates v Milwaukee Brewers,2025-05-23T07:40:00Z,Head To Head,Pittsburgh Pirates,2,Milwaukee Brewers,1.81,1.052,Sportsbet
Detroit Tigers v Cleveland Guardians,2025-05-23T07:40:00Z,Head To Head,Detroit Tigers,1.69,Cleveland Guardians,2.17,1.053,Sportsbet
Washington Nationals v Atlanta Braves,2025-05-23T07:45:00Z,Head To Head,Washington Nationals,2.28,Atlanta Braves,1.63,1.052,Sportsbet
Boston Red Sox v Baltimore Orioles,2025-05-23T07:45:00Z,Head To Head,Boston Red Sox,1.77,Baltimore Orioles,2.06,1.05,Sportsbet
Houston Astros v Seattle Mariners,2025-05-23T09:10:00Z,Head To Head,Houston Astros,2.08,Seattle Mariners,1.74,1.055,Sportsbet
