match,start_time,market_name,home_team,home_win,away_team,away_win,margin,agency
San Diego Padres v Pittsburgh Pirates,2025-06-02 06:40:00,Head To Head,San Diego Padres,2.9,Pittsburgh Pirates,1.4,1.059,TAB
Los Angeles Dodgers v New York Yankees,2025-06-02 08:40:00,Head To Head,Los Angeles Dodgers,1.87,New York Yankees,1.9,1.061,TAB
Miami Marlins v Colorado Rockies,2025-06-03 08:10:00,Head To Head,Miami Marlins,1.52,Colorado Rockies,2.6,1.043,TAB
Boston Red Sox v Los Angeles Angels,2025-06-03 08:40:00,Head To Head,Boston Red Sox,1.65,Los Angeles Angels,2.3,1.041,TAB
Cincinnati Reds v Milwaukee Brewers,2025-06-03 08:40:00,Head To Head,Cincinnati Reds,1.8,Milwaukee Brewers,2.05,1.043,TAB
Chicago White Sox v Detroit Tigers,2025-06-03 09:10:00,Head To Head,Chicago White Sox,2.7,Detroit Tigers,1.5,1.037,TAB
Oakland Athletics v Minnesota Twins,2025-06-03 11:35:00,Head To Head,Oakland Athletics,2.4,Minnesota Twins,1.6,1.042,TAB
