match,start_time,market_name,home_team,home_win,away_team,away_win,margin,agency
Baltimore Orioles v Texas Rangers,2025-06-24 08:05:00,Head To Head,Baltimore Orioles,1.75,Texas Rangers,2.1,1.048,TAB
Cincinnati Reds v New York Yankees,2025-06-24 08:40:00,Head To Head,Cincinnati Reds,2.05,New York Yankees,1.8,1.043,TAB
New York Mets v Atlanta Braves,2025-06-24 08:40:00,Head To Head,New York Mets,2.15,Atlanta Braves,1.75,1.037,TAB
Chicago White Sox v Arizona Diamondbacks,2025-06-24 09:10:00,Head To Head,Chicago White Sox,2.15,Arizona Diamondbacks,1.75,1.037,TAB
Milwaukee Brewers v Pittsburgh Pirates,2025-06-24 09:10:00,Head To Head,Milwaukee Brewers,1.55,Pittsburgh Pirates,2.5,1.045,TAB
Minnesota Twins v Seattle Mariners,2025-06-24 09:10:00,Head To Head,Minnesota Twins,2.1,Seattle Mariners,1.75,1.048,TAB
St. Louis Cardinals v Chicago Cubs,2025-06-24 09:15:00,Head To Head,St. Louis Cardinals,1.92,Chicago Cubs,1.92,1.042,TAB
Los Angeles Angels v Boston Red Sox,2025-06-24 11:08:00,Head To Head,Los Angeles Angels,2,Boston Red Sox,1.85,1.041,TAB
San Diego Padres v Washington Nationals,2025-06-24 11:10:00,Head To Head,San Diego Padres,1.6,Washington Nationals,2.4,1.042,TAB
