match,start_time,market_name,home_team,home_win,away_team,away_win,margin,agency
Baltimore Orioles v Detroit Tigers,2025-06-12 08:05:00,Head To Head,Baltimore Orioles,1.06,Detroit Tigers,9,1.055,TAB
Boston Red Sox v Tampa Bay Rays,2025-06-12 08:40:00,Head To Head,Boston Red Sox,1.38,Tampa Bay Rays,3,1.058,TAB
New York Mets v Washington Nationals,2025-06-12 08:40:00,Head To Head,New York Mets,1.02,Washington Nationals,21,1.028,TAB
Kansas City Royals v New York Yankees,2025-06-12 09:10:00,Head To Head,Kansas City Royals,9,New York Yankees,1.06,1.055,TAB
Minnesota Twins v Texas Rangers,2025-06-12 09:10:00,Head To Head,Minnesota Twins,1.38,Texas Rangers,3,1.058,TAB
Houston Astros v Chicago White Sox,2025-06-12 09:40:00,Head To Head,Houston Astros,1.08,Chicago White Sox,7.5,1.059,TAB
Colorado Rockies v San Francisco Giants,2025-06-12 10:10:00,Head To Head,Colorado Rockies,2.6,San Francisco Giants,1.52,1.043,TAB
Milwaukee Brewers v St. Louis Cardinals,2025-06-13 09:10:00,Head To Head,Milwaukee Brewers,2.1,St. Louis Cardinals,1.75,1.048,TAB
Chicago Cubs v Pittsburgh Pirates,2025-06-13 09:35:00,Head To Head,Chicago Cubs,1.5,Pittsburgh Pirates,2.7,1.037,TAB
