match,start_time,market_name,home_team,home_win,away_team,away_win,margin,agency
Los Angeles Dodgers v San Francisco Giants,2025-06-16 08:40:00,Head To Head,Los Angeles Dodgers,1.09,San Francisco Giants,7,1.06,TAB
Miami Marlins v Philadelphia Phillies,2025-06-17 08:10:00,Head To Head,Miami Marlins,2.1,Philadelphia Phillies,1.75,1.048,TAB
Washington Nationals v Colorado Rockies,2025-06-17 08:15:00,Head To Head,Washington Nationals,1.5,Colorado Rockies,2.7,1.037,TAB
New York Yankees v Los Angeles Angels,2025-06-17 08:35:00,Head To Head,New York Yankees,1.5,Los Angeles Angels,2.7,1.037,TAB
Tampa Bay Rays v Baltimore Orioles,2025-06-17 09:05:00,Head To Head,Tampa Bay Rays,1.8,Baltimore Orioles,2.05,1.043,TAB
Seattle Mariners v Boston Red Sox,2025-06-17 11:10:00,Head To Head,Seattle Mariners,1.58,Boston Red Sox,2.5,1.033,TAB
Los Angeles Dodgers v San Diego Padres,2025-06-17 11:40:00,Head To Head,Los Angeles Dodgers,1.7,San Diego Padres,2.2,1.043,TAB
