match,start_time,market_name,home_team,home_win,away_team,away_win,margin,agency
Minnesota Twins v Texas Rangers,2025-06-13 02:40:00,Head To Head,Minnesota Twins,1.62,Texas Rangers,2.4,1.034,TAB
New York Mets v Washington Nationals,2025-06-13 02:40:00,Head To Head,New York Mets,1.42,Washington Nationals,3,1.038,TAB
Colorado Rockies v San Francisco Giants,2025-06-13 04:40:00,Head To Head,Colorado Rockies,2.9,San Francisco Giants,1.45,1.034,TAB
Baltimore Orioles v Detroit Tigers,2025-06-13 08:05:00,Head To Head,Baltimore Orioles,2.5,Detroit Tigers,1.55,1.045,TAB
Kansas City Royals v New York Yankees,2025-06-13 09:10:00,Head To Head,Kansas City Royals,2.25,New York Yankees,1.68,1.04,TAB
Milwaukee Brewers v St. Louis Cardinals,2025-06-13 09:10:00,Head To Head,Milwaukee Brewers,2.1,St. Louis Cardinals,1.75,1.048,TAB
Chicago Cubs v Pittsburgh Pirates,2025-06-13 09:35:00,Head To Head,Chicago Cubs,1.48,Pittsburgh Pirates,2.7,1.046,TAB
Houston Astros v Chicago White Sox,2025-06-13 09:40:00,Head To Head,Houston Astros,1.4,Chicago White Sox,3.1,1.037,TAB
