match,start_time,market_name,home_team,home_win,away_team,away_win,margin,agency
Philadelphia Phillies v San Diego Padres,2025-07-01 08:05:00,Head To Head,Philadelphia Phillies,1.45,San Diego Padres,2.8,1.047,TAB
Pittsburgh Pirates v St. Louis Cardinals,2025-07-01 08:10:00,Head To Head,Pittsburgh Pirates,1.92,St. Louis Cardinals,1.92,1.042,TAB
Toronto Blue Jays v New York Yankees,2025-07-01 08:37:00,Head To Head,Toronto Blue Jays,2.2,New York Yankees,1.7,1.043,TAB
Boston Red Sox v Cincinnati Reds,2025-07-01 08:40:00,Head To Head,Boston Red Sox,1.58,Cincinnati Reds,2.5,1.033,TAB
Tampa Bay Rays v Oakland Athletics,2025-07-01 09:05:00,Head To Head,Tampa Bay Rays,1.55,Oakland Athletics,2.5,1.045,TAB
Texas Rangers v Baltimore Orioles,2025-07-01 09:35:00,Head To Head,Texas Rangers,1.92,Baltimore Orioles,1.92,1.042,TAB
Arizona Diamondbacks v San Francisco Giants,2025-07-01 11:10:00,Head To Head,Arizona Diamondbacks,2.15,San Francisco Giants,1.75,1.037,TAB
Seattle Mariners v Kansas City Royals,2025-07-01 11:10:00,Head To Head,Seattle Mariners,1.65,Kansas City Royals,2.3,1.041,TAB
